{"$schema":"https://json-schema.org/draft/2020-12/schema","$id":"https://vexil-lang.org/release/history/entries/entry-release-surface-observations-2026-07-23.json","version":"1.0","recordKind":"release-history-ledger-entry","entryId":"entry-release-surface-observations-2026-07-23","observationIds":["observation-github-releases-2026-07-23","observation-release-artifacts-2026-07-23","observation-crates-io-2026-07-23","observation-npm-runtime-2026-07-23","observation-package-manifests-2026-07-23","observation-pypi-vexil-runtime-2026-07-23","observation-go-proxy-runtime-2026-07-23"],"classification":"contradiction","reviewState":"unresolved","review":{"actorId":"github:furkanmamuk","reviewedAt":"2026-07-23T13:37:10Z"},"summary":"Current public releases, crate and npm metadata, local package manifests, the scoped missing PyPI identity, and empty exact Go proxy response describe divergent release surfaces. They remain unresolved source-attributed observations rather than a synthesized release narrative."}
