{
  "$schema": "https://json-schema.org/draft/2020-12/schema",
  "$id": "https://vexil-lang.org/release/history/entries/entry-root-v1-0-0-changelog-anomaly-2026-07-23.json",
  "version": "1.0",
  "recordKind": "release-history-ledger-entry",
  "entryId": "entry-root-v1-0-0-changelog-anomaly-2026-07-23",
  "observationIds": ["observation-root-changelog-v1-0-0-2026-07-23"],
  "classification": "anomaly",
  "reviewState": "accepted",
  "review": {"actorId": "github:furkanmamuk", "reviewedAt": "2026-07-23T13:33:17Z"},
  "summary": "The root changelog contains a v1.0.0 claim, while the ratified Historical Tag baseline contains no root v1.0.0 tag. The claim remains visible as an audited anomaly and does not establish a coordinated historical release."
}
