{"$schema":"https://json-schema.org/draft/2020-12/schema","$id":"https://vexil-lang.org/release/history/entries/entry-go-runtime-observed-publication-2026-07-26.json","version":"1.0","recordKind":"release-history-ledger-entry","entryId":"entry-go-runtime-observed-publication-2026-07-26","observationIds":["observation-go-proxy-runtime-v0-1-0-2026-07-26"],"classification":"correction","reviewState":"accepted","review":{"actorId":"github:furkanmamuk","reviewedAt":"2026-07-26T18:19:35Z"},"correctionOf":"entry-release-surface-observations-2026-07-23","summary":"A fresh read-only Go module proxy observation establishes public availability of runtime-go v0.1.0. It corrects only the earlier empty exact-path observation; it remains provider evidence and does not retroactively create a governed Release Set, Manifest, approval, Run, or publication claim."}
